{"$schema":"https://json-schema.org/draft/2020-12/schema","type":"object","additionalProperties":false,"required":["schema_version","status","decision_date","decision_source","authority_role","scope","basis","formal_ethics_application_required","formal_privacy_application_required","privacy_controls_required","privacy_controls","supersedes_pending_packets","does_not_authorize","freeze_effect","stage_1_execution_gate_closed","stage_1_execution_started","reopen_on","promotion_allowed","upstream_write_authorized"],"properties":{"schema_version":{"const":"ethics-privacy-determination-v1"},"status":{"const":"determination_recorded_no_formal_application_required"},"decision_date":{"const":"2026-08-12"},"decision_source":{"type":"string","minLength":1},"authority_role":{"type":"string","minLength":1},"scope":{"type":"object","additionalProperties":false,"required":["freeze_id","languages","source_snapshots","activity"],"properties":{"freeze_id":{"const":"g3-option-b-es-ja-20260812-v1"},"languages":{"const":["es","ja"]},"source_snapshots":{"const":["hpo-translation-es-repository-snapshot","hpo-translation-ja-repository-snapshot"]},"activity":{"type":"string","minLength":1}}},"basis":{"type":"array","minItems":7,"uniqueItems":true,"items":{"type":"string","minLength":1}},"formal_ethics_application_required":{"const":false},"formal_privacy_application_required":{"const":false},"privacy_controls_required":{"const":true},"privacy_controls":{"type":"array","minItems":4,"uniqueItems":true,"items":{"type":"string","minLength":1}},"supersedes_pending_packets":{"const":["g2-ethics-privacy"]},"does_not_authorize":{"type":"array","minItems":6,"uniqueItems":true,"items":{"type":"string","minLength":1}},"freeze_effect":{"const":"post_freeze_gate_receipt_does_not_modify_frozen_components"},"stage_1_execution_gate_closed":{"const":true},"stage_1_execution_started":{"const":false},"reopen_on":{"type":"array","minItems":5,"uniqueItems":true,"items":{"type":"string","minLength":1}},"promotion_allowed":{"const":false},"upstream_write_authorized":{"const":false}}}
